{
  "contractId": "spts.controller-store-receipt.v2",
  "schemaVersion": 2,
  "algorithm": "hmac-sha256",
  "algorithmVersion": 1,
  "namespaceDigest": "befaab798f2cec8585ed4bbc7c876320d3f27fe7b5d78074a342e90a873948b8",
  "keyId": "test-key-1",
  "taskId": "task-1",
  "projectId": "project-1",
  "repositoryId": "repo-1",
  "runId": "snapshot-1",
  "branch": "main",
  "candidateCommit": "2222222222222222222222222222222222222222",
  "candidateTree": "3333333333333333333333333333333333333333",
  "previousRevision": 0,
  "committedRevision": 1,
  "previousSnapshotDigest": "4444444444444444444444444444444444444444444444444444444444444444",
  "transitionDigest": "5555555555555555555555555555555555555555555555555555555555555555",
  "proposalDigest": "6666666666666666666666666666666666666666666666666666666666666666",
  "orderedChangesDigest": "7777777777777777777777777777777777777777777777777777777777777777",
  "orderedIntentsDigest": "8888888888888888888888888888888888888888888888888888888888888888",
  "transitionChainDigest": "5555555555555555555555555555555555555555555555555555555555555555",
  "committedSnapshotDigest": "9999999999999999999999999999999999999999999999999999999999999999",
  "operationIdentity": "commit-operation-1",
  "idempotencyIdentity": "op-a027095446856e09767266314e8cff6cba5b8e7b066941ffa0fd2b5704ab5ffb",
  "canonicalRequestDigest": "aaaaaaaaaaaaaaaaaaaaaaaaaaaaaaaaaaaaaaaaaaaaaaaaaaaaaaaaaaaaaaaa",
  "committedAt": "2026-09-02T00:00:01.000Z",
  "previousReceiptDigest": null,
  "recordDigest": "bbbbbbbbbbbbbbbbbbbbbbbbbbbbbbbbbbbbbbbbbbbbbbbbbbbbbbbbbbbbbbbb",
  "receiptDigest": "d9d0dbc22df0314ef7b101873832ecdd91e3483c1375b383def41980bb7df023",
  "authenticationTag": "e798287513a64b7251868ce3a34b0e889fa353c50b85281e9c556022e47228a6"
}
